{
  "package_name": "test_app",
  "version": "1.0.0",
  "created_at": "2026-01-30T14:18:23.213570Z",
  "file_info": {
    "archive_name": "test_app_v1.0.0.zip",
    "size": 947,
    "file_count": 4,
    "hash": "sha256:ab458da3b12ac36bbbc8c0d42c1dbd70a173c9e1a27af45c243e9cd3c04fd965"
  },
  "files": [
    {
      "path": "README.md",
      "size": 209,
      "hash": "sha256:38ca6447075919224d3a6a40f7657bc950851c2edcc9d4c7b734f6c05495ef0a"
    },
    {
      "path": "lib/utils.py",
      "size": 163,
      "hash": "sha256:7c42ead64987bdc767b95fb32e4dd6a58db3dd7ca74c616f092d00ecde0a130d"
    },
    {
      "path": "data/config.json",
      "size": 183,
      "hash": "sha256:4559c613b2e94a803f82c46cdcf9672d9aa35f88c83c838b18b100aff535f542"
    },
    {
      "path": "src/main.py",
      "size": 175,
      "hash": "sha256:32aa8a76ea972238e267c8f6d4eb2c22b0a0c68f0a055210cbbb4e1bf80cc141"
    }
  ]
}